{"policyId":"00000000-0000-4000-8000-000000000201","policyVersion":"1.0.0","issuedAt":"2026-07-15T00:00:00.000Z","operation":"DOCUMENT_CONVERSION","allowedInputArtifactIds":["00000000-0000-4000-8000-000000000101"],"stagingPrefix":"staging/00000000-0000-4000-8000-000000000301/00000000-0000-4000-8000-000000000401","allowedOutputMediaTypes":["text/markdown","application/json"],"maxWallTimeMs":60000,"cancellationGraceMs":10000,"maxInputBytes":10485760,"maxOutputBytes":52428800,"maxArtifactBytes":52428800,"maxOutputArtifacts":100,"maxWarnings":100,"maxMemoryBytes":2147483648,"maxDiskBytes":1073741824,"networkMode":"DENY_ALL","allowExternalResources":false,"allowEmbeddedFiles":false,"maxEmbeddedFiles":0,"maxArchiveEntries":0,"maxArchiveDepth":0,"maxExpandedBytes":52428800,"maxCompressionRatio":100,"maxPages":1000,"maxRows":1000000,"maxColumns":10000}
